{
  "schema_version": "kernector.rag-judge-baseline.v1",
  "accepted": false,
  "allowed_drop": 0.05,
  "means": {
    "context_relevance": 0.0,
    "faithfulness": 0.0,
    "answer_correctness": 0.0,
    "citation_accuracy": 0.0,
    "citation_completeness": 0.0
  },
  "fingerprints": {
    "dataset_hash": "0000000000000000000000000000000000000000000000000000000000000000",
    "corpus_hash": "0000000000000000000000000000000000000000000000000000000000000000",
    "metric_set": [
      "context_relevance",
      "faithfulness",
      "answer_correctness",
      "citation_accuracy",
      "citation_completeness"
    ],
    "judge_provider": "unaccepted",
    "judge_model": "placeholder",
    "prompt_version": "kernector.rag-judge.prompts.v1",
    "answer_provider": "unaccepted",
    "answer_model": "placeholder",
    "embedding_model": "placeholder",
    "retrieval_limit": 5,
    "relevance_threshold": 0.0,
    "hybrid_enabled": true,
    "hybrid_alpha": 0.5,
    "rewriter": "placeholder"
  }
}
